[
  {
    "schemaVersion": "conversation-turn.v1",
    "id": "turn-summary-001",
    "sessionId": "session-pill-discussion",
    "role": "assistant",
    "turnType": "interjection_summary",
    "status": "complete",
    "summary": "The user's interjections question whether the examples prove the claim.",
    "text": "The user's interjections focus on whether the anecdotal alternatives are repetitive or genuinely clarifying.",
    "rawText": "<sm_summary>The user's interjections question whether the examples prove the claim.</sm_summary><sm_response>The user's interjections focus on whether the anecdotal alternatives are repetitive or genuinely clarifying.</sm_response>",
    "sourceInterjectionIds": ["ij-source-001"],
    "createdAt": "2026-06-11T12:30:00.000Z",
    "completedAt": "2026-06-11T12:30:20.000Z",
    "error": null
  },
  {
    "schemaVersion": "conversation-turn.v1",
    "id": "turn-addendum-001",
    "sessionId": "session-pill-discussion",
    "role": "user",
    "turnType": "addendum",
    "status": "complete",
    "summary": null,
    "text": "Add that I am mainly worried about whether the author handles regression to the mean.",
    "rawText": "Add that I am mainly worried about whether the author handles regression to the mean.",
    "sourceInterjectionIds": [],
    "createdAt": "2026-06-11T12:32:00.000Z",
    "completedAt": "2026-06-11T12:32:00.000Z",
    "error": null
  },
  {
    "schemaVersion": "conversation-turn.v1",
    "id": "turn-response-001",
    "sessionId": "session-pill-discussion",
    "role": "assistant",
    "turnType": "assistant_response",
    "status": "complete",
    "summary": "The core issue is whether the author distinguishes evidence from alternative explanations.",
    "text": "AI response first point. AI response second point.",
    "rawText": "<sm_summary>The core issue is whether the author distinguishes evidence from alternative explanations.</sm_summary><sm_response>AI response first point. AI response second point.</sm_response>",
    "sourceInterjectionIds": ["ij-source-001"],
    "createdAt": "2026-06-11T12:34:00.000Z",
    "completedAt": "2026-06-11T12:34:30.000Z",
    "error": null
  }
]
